{
  "$schema": "../schema/schedule.schema.json",
  "id": "de-stiko",
  "name": { "de": "STIKO-Empfehlungen (Deutschland)", "en": "STIKO recommendations (Germany)" },
  "version": "2026-09",
  "scope": "Standardimpfungen für alle Altersgruppen. Indikations-, Berufs- und Reiseimpfungen sind nicht enthalten.",
  "simplifications": [
    "Nachholschemata bei spätem Beginn sind vereinfacht abgebildet; maßgeblich ist die ärztliche Beurteilung.",
    "Rotaviren: unabhängig vom Impfstoff 2 Dosen bis zur 32. Lebenswoche (Rotarix: 2 Dosen bis 24 Wochen, RotaTeq: 3 Dosen bis 32 Wochen).",
    "HPV: Ein Abstand unter 5 Monaten zwischen 1. und 2. Dosis (3. Dosis nötig) wird nicht erkannt.",
    "Frühgeborene (3+1-Schema) werden nicht gesondert behandelt.",
    "RSV-Prophylaxe für Säuglinge (monoklonale Antikörper) ist keine Impfung und nicht enthalten."
  ],
  "sources": [
    "https://edoc.rki.de/handle/176904/13181.6",
    "https://www.kbv.de/praxis/tools-und-services/praxisnachrichten/2026/09-03/g-ba-aendert-schutzimpfungsrichtlinie-covid-19-impfung-fuer-gesunde-kuenftig-erst-ab-75-jahren",
    "https://arztinfo.kvsa.de/fileadmin/user_upload/PDF/Praxis/Impfen/26_02_18_Aktueller_Stand_MenACWY_B_Standard_KVSA_HP.pdf"
  ],
  "rules": [
    {
      "id": "td",
      "diseases": ["tetanus", "diphtheria"],
      "kind": "series",
      "until": "P18Y",
      "reference": "Epid Bull 4/2026, Tab. 1A/1B, Fußnoten c, f, h",
      "variants": [
        {
          "fromAge": "P0D",
          "doses": [
            { "label": "G1", "age": "P2M" },
            { "label": "G2", "age": "P4M", "minInterval": "P4W" },
            { "label": "G3", "age": "P11M", "minInterval": "P6M" },
            { "label": "A1", "age": "P5Y", "dueUntil": "P7Y", "minInterval": "P5Y" },
            { "label": "A2", "age": "P9Y", "dueUntil": "P17Y", "minInterval": "P5Y" }
          ]
        },
        {
          "fromAge": "P12M",
          "doses": [
            { "label": "G1", "age": "P0D" },
            { "label": "G2", "age": "P0D", "minInterval": "P4W" },
            { "label": "G3", "age": "P0D", "minInterval": "P6M" }
          ]
        }
      ],
      "then": { "every": "P10Y", "grace": "P12M" }
    },
    {
      "id": "pertussis",
      "diseases": ["pertussis"],
      "kind": "series",
      "until": "P18Y",
      "reference": "Epid Bull 4/2026, Tab. 1A/1B, Fußnoten c, f, h",
      "variants": [
        {
          "fromAge": "P0D",
          "doses": [
            { "label": "G1", "age": "P2M" },
            { "label": "G2", "age": "P4M", "minInterval": "P4W" },
            { "label": "G3", "age": "P11M", "minInterval": "P6M" },
            { "label": "A1", "age": "P5Y", "dueUntil": "P7Y", "minInterval": "P5Y" },
            { "label": "A2", "age": "P9Y", "dueUntil": "P17Y", "minInterval": "P5Y" }
          ]
        },
        {
          "fromAge": "P12M",
          "doses": [
            { "label": "G1", "age": "P0D" },
            { "label": "G2", "age": "P0D", "minInterval": "P4W" },
            { "label": "G3", "age": "P0D", "minInterval": "P6M" }
          ]
        }
      ]
    },
    {
      "id": "pertussis-adult",
      "diseases": ["pertussis"],
      "kind": "once",
      "fromAge": "P18Y",
      "alignWith": "td",
      "reference": "Epid Bull 4/2026, Tab. 2, Fußnote h: nächste fällige Td-Impfung einmalig als Tdap",
      "doses": [{ "label": "Tdap" }]
    },
    {
      "id": "polio",
      "diseases": ["polio"],
      "kind": "series",
      "until": "P18Y",
      "reference": "Epid Bull 4/2026, Tab. 1A/1B, Fußnoten c, f",
      "variants": [
        {
          "fromAge": "P0D",
          "doses": [
            { "label": "G1", "age": "P2M" },
            { "label": "G2", "age": "P4M", "minInterval": "P4W" },
            { "label": "G3", "age": "P11M", "minInterval": "P6M" },
            { "label": "A1", "age": "P9Y", "dueUntil": "P17Y", "minInterval": "P5Y" }
          ]
        },
        {
          "fromAge": "P12M",
          "doses": [
            { "label": "G1", "age": "P0D" },
            { "label": "G2", "age": "P0D", "minInterval": "P4W" },
            { "label": "G3", "age": "P0D", "minInterval": "P6M" }
          ]
        }
      ]
    },
    {
      "id": "hib",
      "diseases": ["hib"],
      "kind": "series",
      "until": "P5Y",
      "reference": "Epid Bull 4/2026, Tab. 1A, Fußnoten c, f; Nachholung bis zum 5. Geburtstag",
      "variants": [
        {
          "fromAge": "P0D",
          "doses": [
            { "label": "G1", "age": "P2M" },
            { "label": "G2", "age": "P4M", "minInterval": "P4W" },
            { "label": "G3", "age": "P11M", "minInterval": "P6M" }
          ]
        },
        {
          "fromAge": "P12M",
          "doses": [{ "label": "G1", "age": "P0D" }]
        }
      ]
    },
    {
      "id": "hepatitis-b",
      "diseases": ["hepatitis-b"],
      "kind": "series",
      "until": "P18Y",
      "reference": "Epid Bull 4/2026, Tab. 1A, Fußnoten c, f",
      "variants": [
        {
          "fromAge": "P0D",
          "doses": [
            { "label": "G1", "age": "P2M" },
            { "label": "G2", "age": "P4M", "minInterval": "P4W" },
            { "label": "G3", "age": "P11M", "minInterval": "P6M" }
          ]
        },
        {
          "fromAge": "P12M",
          "doses": [
            { "label": "G1", "age": "P0D" },
            { "label": "G2", "age": "P0D", "minInterval": "P4W" },
            { "label": "G3", "age": "P0D", "minInterval": "P5M" }
          ]
        }
      ]
    },
    {
      "id": "pneumococcal-child",
      "diseases": ["pneumococcal"],
      "kind": "series",
      "until": "P2Y",
      "reference": "Epid Bull 4/2026, Tab. 1A, Fußnoten c, d, f",
      "variants": [
        {
          "fromAge": "P0D",
          "doses": [
            { "label": "G1", "age": "P2M" },
            { "label": "G2", "age": "P4M", "minInterval": "P8W" },
            { "label": "G3", "age": "P11M", "minInterval": "P6M" }
          ]
        },
        {
          "fromAge": "P12M",
          "doses": [
            { "label": "G1", "age": "P0D" },
            { "label": "G2", "age": "P0D", "minInterval": "P8W" }
          ]
        }
      ]
    },
    {
      "id": "pneumococcal-senior",
      "diseases": ["pneumococcal"],
      "kind": "once",
      "fromAge": "P60Y",
      "reference": "Epid Bull 4/2026, Tab. 2, Fußnote k: einmalig PCV20 ab 60 Jahren",
      "doses": [{ "label": "PCV20" }]
    },
    {
      "id": "rotavirus",
      "diseases": ["rotavirus"],
      "kind": "series",
      "until": "P32W",
      "reference": "Epid Bull 4/2026, Tab. 1A, Fußnote b",
      "variants": [
        {
          "fromAge": "P0D",
          "doses": [
            { "label": "G1", "age": "P6W", "dueUntil": "P12W" },
            { "label": "G2", "age": "P10W", "minInterval": "P4W", "dueUntil": "P24W" }
          ]
        }
      ]
    },
    {
      "id": "meningococcal-b",
      "diseases": ["meningococcal-b"],
      "kind": "series",
      "until": "P5Y",
      "reference": "Epid Bull 4/2026, Tab. 1A, Fußnoten e, f; Nachholung bis zum 5. Geburtstag",
      "variants": [
        {
          "fromAge": "P0D",
          "doses": [
            { "label": "G1", "age": "P2M" },
            { "label": "G2", "age": "P4M", "minInterval": "P8W" },
            { "label": "G3", "age": "P12M", "minInterval": "P6M" }
          ]
        },
        {
          "fromAge": "P12M",
          "doses": [
            { "label": "G1", "age": "P0D" },
            { "label": "G2", "age": "P0D", "minInterval": "P8W" },
            { "label": "G3", "age": "P0D", "minInterval": "P12M" }
          ]
        },
        {
          "fromAge": "P24M",
          "doses": [
            { "label": "G1", "age": "P0D" },
            { "label": "G2", "age": "P0D", "minInterval": "P4W" }
          ]
        }
      ]
    },
    {
      "id": "meningococcal-acwy",
      "name": { "de": "Meningokokken ACWY", "en": "Meningococcal ACWY" },
      "diseases": ["meningococcal-a", "meningococcal-c", "meningococcal-w", "meningococcal-y"],
      "kind": "series",
      "until": "P25Y",
      "countDosesFromAge": "P12Y",
      "reference": "Epid Bull 4/2026, Tab. 1B; Standard 12–14 Jahre, Nachholung bis einschließlich 24 Jahre, unabhängig von früheren Impfungen",
      "variants": [
        {
          "fromAge": "P0D",
          "doses": [{ "label": "G1", "age": "P12Y", "dueUntil": "P15Y" }]
        }
      ]
    },
    {
      "id": "mmr",
      "diseases": ["measles", "mumps", "rubella"],
      "kind": "series",
      "until": "P18Y",
      "reference": "Epid Bull 4/2026, Tab. 1A, Fußnote *",
      "variants": [
        {
          "fromAge": "P0D",
          "doses": [
            { "label": "G1", "age": "P11M" },
            { "label": "G2", "age": "P15M", "minInterval": "P4W" }
          ]
        }
      ]
    },
    {
      "id": "measles-adult",
      "diseases": ["measles"],
      "kind": "once",
      "fromAge": "P18Y",
      "bornAfter": "1970-12-31",
      "satisfiedByTotalDoses": 2,
      "reference": "Epid Bull 4/2026, Tab. 1B/2, Fußnote i: nach 1970 Geborene ab 18 mit unklarem Status oder nur einer Impfung in der Kindheit",
      "doses": [{ "label": "MMR" }]
    },
    {
      "id": "varicella",
      "diseases": ["varicella"],
      "kind": "series",
      "until": "P18Y",
      "reference": "Epid Bull 4/2026, Tab. 1A, Fußnote *",
      "variants": [
        {
          "fromAge": "P0D",
          "doses": [
            { "label": "G1", "age": "P11M" },
            { "label": "G2", "age": "P15M", "minInterval": "P4W" }
          ]
        }
      ]
    },
    {
      "id": "hpv",
      "diseases": ["hpv"],
      "kind": "series",
      "until": "P18Y",
      "reference": "Epid Bull 4/2026, Tab. 1B, Fußnote g",
      "variants": [
        {
          "fromAge": "P0D",
          "doses": [
            { "label": "G1", "age": "P9Y", "dueUntil": "P15Y" },